{
  "schema_version": 1,
  "workspace": {
    "id": "demo-course",
    "title": "Демо-группа",
    "groups": [
      "demo"
    ]
  },
  "mode": "course",
  "lang": "ru",
  "period": {
    "mode": "labels"
  },
  "sources": [],
  "hook": {
    "enabled": false,
    "providers": [
      "claude"
    ]
  },
  "sanitize": {
    "names": [],
    "extra_patterns": []
  },
  "models": {
    "collector": {
      "model": "sonnet",
      "effort": "medium"
    },
    "judge": {
      "model": "opus",
      "effort": "high"
    },
    "critic": {
      "model": "sonnet",
      "effort": "medium"
    }
  },
  "batches": {
    "max_bytes": 100000,
    "max_user_turns": 150,
    "min_turns": 4
  },
  "show_scores": false,
  "reviewer_gate": true,
  "template": "default",
  "extensions": {
    "artifact": null
  }
}
